{
  "archive_path": "data/raw/battery_archive/SNL LFP.zip",
  "bounded_source_id": "snl_lfp_commercial_18650_study",
  "case_study_id": "battery_archive_snl_lfp",
  "credential_policy": {
    "network_access_required": false,
    "store_credentials": false
  },
  "cycle_regime_contract_path": "data/platform/battery_snl_lfp_bounded_cycle_regime_contract_v1.json",
  "cycle_row_policy": {
    "bulk_candidate_row_count": 5,
    "capacity_check_candidate_row_count": 3,
    "max_data_rows_per_entry": 8,
    "max_line_bytes": 65536,
    "preserve_exact_decimal_strings": true,
    "retain_only_selected_measurement_fields": true
  },
  "dry_run": false,
  "execution_mode": "bounded_local_cycle_regime_review",
  "expected_archive_sha256": "006a335cbcdabc858a85ab0cdbc59a7001150751cf22abe8a7132c85ef63223d",
  "expected_v2_6_8_checksum": "28c68acecdce55787189ddd981c097d1748504dab43b3777b896638652fb70f2",
  "output_policy": "local_full_result_and_tracked_compact_summary",
  "output_root": "outputs/v2_6_battery_snl_lfp_bounded_cycle_regime",
  "package_id": "battery_snl_lfp_bounded_cycle_regime_review_v1",
  "read_policy": {
    "allow_archive_extraction": false,
    "allow_archive_sha256": true,
    "allow_csv_header_read": true,
    "allow_first_eight_cycle_rows": true,
    "allow_full_csv_read": false,
    "allow_nonrepresentative_entry_read": false,
    "allow_representative_cycle_entry_payload_read": true,
    "allow_time_series_entry_read": false,
    "allow_tracked_json_reads": true,
    "allow_zip_central_directory": true
  },
  "representative_entries": [
    "SNL LFP/SNL_18650_LFP_25C_0-100_0.5-1C_a_cycle_data.csv",
    "SNL LFP/SNL_18650_LFP_25C_20-80_0.5-0.5C_a_cycle_data.csv",
    "SNL LFP/SNL_18650_LFP_25C_40-60_0.5-0.5C_a_cycle_data.csv"
  ],
  "schema_version": "2.6.9",
  "tracked_summary_path": "data/processed/battery_v2_6_9_snl_lfp_bounded_cycle_regime_summary.json",
  "v2_6_8_bounded_schema_summary_path": "data/processed/battery_v2_6_8_snl_lfp_bounded_schema_read_summary.json"
}
